{
  "contract": "ai_daily_worker",
  "protocol_version": 1,
  "worker_kind": "python_document",
  "worker_contract_version": "ai_daily_worker_v1",
  "worker_version": "0.1.0",
  "worker_build": "fixture-python-worker-build-v1",
  "supported_backends": [
    "python_office_v2",
    "python_pdf_text_v2",
    "python_sharepoint_text_v2"
  ],
  "supported_extensions": [
    ".doc",
    ".docx",
    ".pdf",
    ".ppt",
    ".pptx",
    ".xls",
    ".xlsx"
  ]
}
