{
  "contract": "ai_daily_worker",
  "protocol_version": 1,
  "worker_kind": "office",
  "worker_contract_version": "ai_daily_worker_v1",
  "worker_version": "0.1.0",
  "worker_build": "fixture-office-worker-build-v1",
  "supported_backends": [
    "rust_office_oxide_v2",
    "rust_xlsx_bounded_v2"
  ],
  "supported_extensions": [
    ".docx",
    ".pptx",
    ".xlsx"
  ]
}
